{"$schema":"https://json-schema.org/draft/2020-12/schema","$id":"https://novel-production-os.local/schemas/soft-features.v1.schema.json","type":"object","additionalProperties":false,"required":["schema_version","samples_hash","split_hash","label_free","records","features_hash"],"properties":{"schema_version":{"const":"soft-features.v1"},"samples_hash":{"$ref":"#/$defs/hash"},"split_hash":{"$ref":"#/$defs/hash"},"label_free":{"const":true},"records":{"type":"array","minItems":90,"maxItems":90,"items":{"type":"object","additionalProperties":false,"required":["sample_id","sample_hash","detector_id","split","extractor_id","extractor_version","features","feature_hash"],"properties":{"sample_id":{"type":"string"},"sample_hash":{"$ref":"#/$defs/hash"},"detector_id":{"enum":["persona_drift","trope_repeat","word_count_cheat"]},"split":{"enum":["train","calibration","holdout"]},"extractor_id":{"const":"soft_feature_extractor"},"extractor_version":{"const":"v1"},"features":{"oneOf":[{"$ref":"#/$defs/persona"},{"$ref":"#/$defs/trope"},{"$ref":"#/$defs/word"}]},"feature_hash":{"$ref":"#/$defs/hash"}}}},"features_hash":{"$ref":"#/$defs/hash"}},"$defs":{"hash":{"type":"string","pattern":"^sha256:[0-9a-f]{64}$"},"nullable_number":{"type":["number","null"]},"persona":{"type":"object","additionalProperties":false,"required":["annotation_count","baseline_present","candidate_present","persona_baseline_mismatch"],"properties":{"annotation_count":{"type":"integer"},"baseline_present":{"type":"boolean"},"candidate_present":{"type":"boolean"},"persona_baseline_mismatch":{"type":["boolean","null"]}}},"trope":{"type":"object","additionalProperties":false,"required":["sentence_count","unique_sentence_count","unique_sentence_ratio","max_normalized_sentence_frequency","repeated_sentence_excess"],"properties":{"sentence_count":{"type":"integer"},"unique_sentence_count":{"type":"integer"},"unique_sentence_ratio":{"$ref":"#/$defs/nullable_number"},"max_normalized_sentence_frequency":{"type":"integer"},"repeated_sentence_excess":{"type":"integer"}}},"word":{"type":"object","additionalProperties":false,"required":["non_whitespace_char_count","sentence_count","unique_sentence_ratio","max_normalized_sentence_frequency","filler_character_ratio"],"properties":{"non_whitespace_char_count":{"type":"integer"},"sentence_count":{"type":"integer"},"unique_sentence_ratio":{"$ref":"#/$defs/nullable_number"},"max_normalized_sentence_frequency":{"type":"integer"},"filler_character_ratio":{"$ref":"#/$defs/nullable_number"}}}}}