{"features_hash":"sha256:b724b35c1dfb321f44718ad01373b1c6117374af32f26ea3e5dbd4b2679f1aa6","label_free":true,"records":[{"detector_id":"persona_drift","extractor_id":"soft_feature_extractor","extractor_version":"v1","feature_hash":"sha256:fefdb78a117e4bd51618caaf296246f9b9cb73b4153b349fad517a509fac6b3d","features":{"annotation_count":1,"baseline_present":true,"candidate_present":true,"persona_baseline_mismatch":true},"sample_hash":"sha256:2156552bed59e997b128714b0ab64425f96b51366927a200dbae0faf92929909","sample_id":"soft_persona_drift_01","split":"train"},{"detector_id":"persona_drift","extractor_id":"soft_feature_extractor","extractor_version":"v1","feature_hash":"sha256:1135b2b92703a50ec5d012fa3cb3f1c76f3bb555ab7f7972ffe75e38274aa92d","features":{"annotation_count":1,"baseline_present":true,"candidate_present":true,"persona_baseline_mismatch":true},"sample_hash":"sha256:d269fd02e0dd1a4f7f1f9c5de2390f96f486a782b627c79ce8fa9ca275822be2","sample_id":"soft_persona_drift_02","split":"train"},{"detector_id":"persona_drift","extractor_id":"soft_feature_extractor","extractor_version":"v1","feature_hash":"sha256:ee4eef341c2b3c4eba72a6c10948cbdc7aaa7e0006b6c261fed4a10d2adc7c75","features":{"annotation_count":1,"baseline_present":true,"candidate_present":true,"persona_baseline_mismatch":true},"sample_hash":"sha256:f053d3185bb7b1128c4136bc10497e57419636f501fb412b1c31634078f89291","sample_id":"soft_persona_drift_03","split":"train"},{"detector_id":"persona_drift","extractor_id":"soft_feature_extractor","extractor_version":"v1","feature_hash":"sha256:223d488263f3848d9f7242048995b04991ad83e06dce1d4fb4024164eea35c18","features":{"annotation_count":1,"baseline_present":true,"candidate_present":true,"persona_baseline_mismatch":true},"sample_hash":"sha256:e30e8818a1a7f895fc4604a4d408041f3b1376462f1de981a9031c80a53215ae","sample_id":"soft_persona_drift_04","split":"train"},{"detector_id":"persona_drift","extractor_id":"soft_feature_extractor","extractor_version":"v1","feature_hash":"sha256:0dc65decb817940f24bdddc14d47e666a411648a6c4ef1a44f91eec21f7a3d63","features":{"annotation_count":1,"baseline_present":true,"candidate_present":true,"persona_baseline_mismatch":true},"sample_hash":"sha256:73c2fe4e82668bacc0252cb5719e22ce643ebf8d2e175d999990bd60de50cd5d","sample_id":"soft_persona_drift_05","split":"train"},{"detector_id":"persona_drift","extractor_id":"soft_feature_extractor","extractor_version":"v1","feature_hash":"sha256:a5c2bb4442c0b693f6c89ef01760bd471ee89c76b7c2c553be3b157f198c4686","features":{"annotation_count":1,"baseline_present":true,"candidate_present":true,"persona_baseline_mismatch":true},"sample_hash":"sha256:3c4c0125e3dceac3669e2a4f34634b4e6765f4d2dc8c08a4885e05df61975655","sample_id":"soft_persona_drift_06","split":"train"},{"detector_id":"persona_drift","extractor_id":"soft_feature_extractor","extractor_version":"v1","feature_hash":"sha256:e0d6ab8b9092405f4bbe1a341b13ec556ef9a61b50e3cf0b6499cc6ef7c061db","features":{"annotation_count":1,"baseline_present":true,"candidate_present":true,"persona_baseline_mismatch":false},"sample_hash":"sha256:bc20833ae0892b59d631517b2c5cf28dbad803fa4558d0f65eba529b5baf33ef","sample_id":"soft_persona_drift_07","split":"train"},{"detector_id":"persona_drift","extractor_id":"soft_feature_extractor","extractor_version":"v1","feature_hash":"sha256:1693c175b4c06d8f0c031911834cab316dc0029d314bef88b25cc5ef7dfbc30b","features":{"annotation_count":1,"baseline_present":true,"candidate_present":true,"persona_baseline_mismatch":false},"sample_hash":"sha256:0a4f3fd6661b9bea917915c80bbbbd918d7cfb6a7d098793b42f5e5ac1d93b88","sample_id":"soft_persona_drift_08","split":"train"},{"detector_id":"persona_drift","extractor_id":"soft_feature_extractor","extractor_version":"v1","feature_hash":"sha256:c276a33aebc63ccf78ebbb7710605d64945ec191461a5f0cd9e1900775e42edc","features":{"annotation_count":1,"baseline_present":true,"candidate_present":true,"persona_baseline_mismatch":false},"sample_hash":"sha256:2a83a92e94c041847901c9dc26c3cfed3185397c245fb7d5f28c39820573dc13","sample_id":"soft_persona_drift_09","split":"train"},{"detector_id":"persona_drift","extractor_id":"soft_feature_extractor","extractor_version":"v1","feature_hash":"sha256:76d2799b9b69b7459c00343adbb4d25be483c9bbdc4253bb8a0b25c3c3dc6909","features":{"annotation_count":1,"baseline_present":true,"candidate_present":true,"persona_baseline_mismatch":false},"sample_hash":"sha256:c4c985807c7f0ccd8c6ded4b315d458488b431ebe01b17c001c499ec8dd822aa","sample_id":"soft_persona_drift_10","split":"train"},{"detector_id":"persona_drift","extractor_id":"soft_feature_extractor","extractor_version":"v1","feature_hash":"sha256:71a135999596e8d1c763d87cb8f0f266b377d73befdfcff2678e8bfff322a305","features":{"annotation_count":1,"baseline_present":true,"candidate_present":true,"persona_baseline_mismatch":false},"sample_hash":"sha256:d6bb7f6137b0f3e98c873c3b4391d68e0e43476ab5bbaa9e41f9524bf8af90e3","sample_id":"soft_persona_drift_11","split":"train"},{"detector_id":"persona_drift","extractor_id":"soft_feature_extractor","extractor_version":"v1","feature_hash":"sha256:24fe628541a66c656687e5e05f113d6c3bda8cc8373e9543a19902de70f2d69a","features":{"annotation_count":1,"baseline_present":true,"candidate_present":true,"persona_baseline_mismatch":false},"sample_hash":"sha256:a55721bdaf28311c2c37e218a5ad55ddda03427733761ca37fe5347082603998","sample_id":"soft_persona_drift_12","split":"train"},{"detector_id":"persona_drift","extractor_id":"soft_feature_extractor","extractor_version":"v1","feature_hash":"sha256:18f600946945b20ff6576e3dcaf30af34449e5f6cf7d3575974ec9957e6bee2a","features":{"annotation_count":1,"baseline_present":true,"candidate_present":true,"persona_baseline_mismatch":true},"sample_hash":"sha256:74d5e7b7a06964ee1e89f8d616a5b749ac8e582a302e88b288cedf5d38e352e0","sample_id":"soft_persona_drift_13","split":"calibration"},{"detector_id":"persona_drift","extractor_id":"soft_feature_extractor","extractor_version":"v1","feature_hash":"sha256:7e38afbfbfde85933e3b877836cb9be73c92f40b386f71646f39dff85b4da112","features":{"annotation_count":1,"baseline_present":true,"candidate_present":true,"persona_baseline_mismatch":true},"sample_hash":"sha256:0fa541fcc8d0edcc9adf7a968fe00cf140e993134a3032d27c85ddd6809af8b1","sample_id":"soft_persona_drift_14","split":"calibration"},{"detector_id":"persona_drift","extractor_id":"soft_feature_extractor","extractor_version":"v1","feature_hash":"sha256:a87e00925dba2d9eb3ff5048ff3e996fe65122d95b728f30e4ce3c9948403da5","features":{"annotation_count":1,"baseline_present":true,"candidate_present":true,"persona_baseline_mismatch":true},"sample_hash":"sha256:49e011ed2c8a1c63092630ef31cdaad90347dd4e9b86ed191140d8e2370bcaee","sample_id":"soft_persona_drift_15","split":"calibration"},{"detector_id":"persona_drift","extractor_id":"soft_feature_extractor","extractor_version":"v1","feature_hash":"sha256:91e625de3cc8a3b126f795c72880cbc42f1d624a231c5989be8e0c4590a20c8f","features":{"annotation_count":1,"baseline_present":true,"candidate_present":true,"persona_baseline_mismatch":true},"sample_hash":"sha256:c26dd82888d16098dc3cc2fd99f5e879a54e8115a9e01ef5ba7e568b95c3052f","sample_id":"soft_persona_drift_16","split":"calibration"},{"detector_id":"persona_drift","extractor_id":"soft_feature_extractor","extractor_version":"v1","feature_hash":"sha256:77bf08e777d96c7827e3cd42ba631d3f316a82860fc442cc0e9aa9801f064f20","features":{"annotation_count":1,"baseline_present":true,"candidate_present":true,"persona_baseline_mismatch":true},"sample_hash":"sha256:8da511c967d6004c0ebc486ae802c33890617d72090c945f96f0d863669e167c","sample_id":"soft_persona_drift_17","split":"calibration"},{"detector_id":"persona_drift","extractor_id":"soft_feature_extractor","extractor_version":"v1","feature_hash":"sha256:920252dded26e246949fe23d4aa8384c7807de9ca40f474adbde236cca31878c","features":{"annotation_count":1,"baseline_present":true,"candidate_present":true,"persona_baseline_mismatch":false},"sample_hash":"sha256:edc43bb03dc3d037123c858f7d8e588313ade2e7e58652c5c041a423db0e4d23","sample_id":"soft_persona_drift_18","split":"calibration"},{"detector_id":"persona_drift","extractor_id":"soft_feature_extractor","extractor_version":"v1","feature_hash":"sha256:f27ad2d836c0ae36799f2bbc0ef4fb84033ceddd70455f240716f65904b866b0","features":{"annotation_count":1,"baseline_present":true,"candidate_present":true,"persona_baseline_mismatch":false},"sample_hash":"sha256:dbb599d90b609c1b666c356f0e04f32268356cdbe9b3250bae265cc1190d0560","sample_id":"soft_persona_drift_19","split":"calibration"},{"detector_id":"persona_drift","extractor_id":"soft_feature_extractor","extractor_version":"v1","feature_hash":"sha256:9a79b28d49196f734ed008c395ed66930ff84eb1301ac4c9dd0cd204fa6e2da7","features":{"annotation_count":1,"baseline_present":true,"candidate_present":true,"persona_baseline_mismatch":false},"sample_hash":"sha256:b3d8029b3fe360cc580c51d6ffde908155691bac9483dc2b7e93c6ab64c65f37","sample_id":"soft_persona_drift_20","split":"calibration"},{"detector_id":"persona_drift","extractor_id":"soft_feature_extractor","extractor_version":"v1","feature_hash":"sha256:871e917cfa31da4d01f475da873a2039a9635c05e3da94b30eb905d2eade8c10","features":{"annotation_count":1,"baseline_present":true,"candidate_present":true,"persona_baseline_mismatch":false},"sample_hash":"sha256:b052b2ec2335dab7b6dbe98c9e4df6a678ffe5137a71656123be4949720003f9","sample_id":"soft_persona_drift_21","split":"calibration"},{"detector_id":"persona_drift","extractor_id":"soft_feature_extractor","extractor_version":"v1","feature_hash":"sha256:26c1bd54a8dccbaf4703d58c9585ab8558a1b1064683f1616f04c0b2ffbfc1b6","features":{"annotation_count":1,"baseline_present":true,"candidate_present":true,"persona_baseline_mismatch":false},"sample_hash":"sha256:e7040fddbc017ac6a93fcec1c7c9c83783972c2f131c5b7b2a1bc57519e5bf09","sample_id":"soft_persona_drift_22","split":"calibration"},{"detector_id":"persona_drift","extractor_id":"soft_feature_extractor","extractor_ver